{
  "$schema": "../../schemas/benchmark_manifest_v1.schema.json",
  "schema_version": "benchmark_manifest_v1",
  "scope_version": "mit_60001_fall_2016_v1",
  "benchmark": {
    "question_count": 40,
    "answerable_count": 35,
    "out_of_scope_count": 5,
    "ground_truth_range_count": 57,
    "question_schema_version": "chunking_evaluation_question_v1",
    "all_questions_approved": true
  },
  "ground_truth_provenance": {
    "review_status": "human_approved",
    "reviewer_batches": {
      "human_batch_01_2026-07-31": 13,
      "human_batch_02_2026-08-10": 20,
      "human_batch_02_2026-08-11": 7
    },
    "source_review_artifacts_retained": false
  },
  "input_sha256": {
    "evaluation_questions": "81d5a1374118b01d850d7c4808edf89b9432036a4488c49f5150720aa3fc8dee",
    "question_schema": "cf6fb90dc49e78ed0231a9e684a22173e086756a399e904f10d1dd5032ca380f"
  },
  "validation_status": "passed"
}
